{
  "schema_version": "nested_event.v1",
  "nested_event_id": "nested_event_sample",
  "parent_event_id": "semantic_event_sample",
  "raw_event_id": "raw_event_sample",
  "source_archive_id": "source_archive_sample",
  "event_type_code": "relationship_label_probe",
  "goal_domain": "romance_relationship_maintenance",
  "occurred_at": "2026-07-01T20:00:00+08:00",
  "participants_hint": ["user", "target"],
  "tags": ["goal_domain:romance_relationship_maintenance", "confirmation:required"],
  "evidence_refs": ["runtime/source-archives/sample/raw.txt"],
  "evidence_text": "are we dating now?",
  "requires_confirmation": true,
  "confirmation_gate_id": "confirmation_gate_sample",
  "metadata": {
    "semantic_granularity": "semantic_sub_event",
    "sentence_split": false
  },
  "created_at": "2026-07-01T20:00:01+08:00"
}
